{
  "task_id": "gene-dossier-tp53",
  "arm": "agent_without_biocli",
  "status": "completed",
  "final_answer": {
    "summary": "Resolved TP53 to the human gene entity NCBI Gene 7157 / HGNC:11998 and assembled a compact dossier from NCBI Gene, Reactome, and ClinVar.",
    "result": {
      "gene_entity": {
        "symbol": "TP53",
        "species": "Homo sapiens",
        "canonical_ids": {
          "ncbi_gene_id": "7157",
          "hgnc_id": "HGNC:11998"
        },
        "aliases": [
          "p53",
          "BCC7",
          "LFS1"
        ]
      },
      "functional_summary": "Stress-responsive tumor suppressor transcription factor that coordinates cell-cycle arrest, DNA repair, apoptosis, and senescence.",
      "pathway_context": [
        {
          "source": "Reactome",
          "pathway": "Transcriptional Regulation by TP53",
          "stable_id": "R-HSA-3700989",
          "note": "TP53-centered transcriptional program with downstream control of stress-response and cell-fate genes."
        }
      ],
      "interaction_or_network_clue": [
        {
          "source": "Reactome",
          "event": "TP53 binds the BID gene promoter",
          "stable_id": "R-HSA-6791285",
          "note": "Direct promoter-binding event linking TP53 to the apoptosis network."
        }
      ],
      "clinically_relevant_variant_context": [
        {
          "source": "ClinVar",
          "variant": "NM_000546.6(TP53):c.742C>T (p.Arg248Trp)",
          "variation_id": "12347",
          "clinical_significance": "pathogenic",
          "associated_condition": "Li-Fraumeni syndrome",
          "note": "Clinically important DNA-binding-domain TP53 variant."
        }
      ]
    }
  },
  "sources": [
    {
      "label": "NCBI Gene TP53",
      "url": "https://www.ncbi.nlm.nih.gov/gene/7157",
      "record_ids": [
        "7157",
        "HGNC:11998"
      ]
    },
    {
      "label": "Reactome TP53 transcriptional regulation",
      "url": "https://reactome.org/content/detail/R-HSA-3700989",
      "record_ids": [
        "R-HSA-3700989"
      ]
    },
    {
      "label": "Reactome TP53-BID promoter binding event",
      "url": "https://reactome.org/content/detail/R-HSA-6791285",
      "record_ids": [
        "R-HSA-6791285"
      ]
    },
    {
      "label": "ClinVar TP53 c.742C>T (p.Arg248Trp)",
      "url": "https://www.ncbi.nlm.nih.gov/clinvar/variation/12347/",
      "record_ids": [
        "12347"
      ]
    }
  ],
  "commands_used": [
    "mkdir -p /Volumes/KINGSTON/work/research/biocli/ncbicli/benchmarks/agent-ab/results/2026-04-15/raw/agent_without_biocli/gene-dossier-tp53",
    "apply_patch"
  ],
  "web_queries": [
    "site:ncbi.nlm.nih.gov/gene TP53 7157 NCBI Gene",
    "site:reactome.org TP53 Reactome Homo sapiens pathway",
    "site:ncbi.nlm.nih.gov/clinvar TP53 Li-Fraumeni syndrome pathogenic variation ID"
  ],
  "warnings": [],
  "errors": [],
  "recovery_actions": [],
  "runtime": {
    "wall_clock_ms": 0,
    "tool_calls": 9
  }
}
