{
  "task_id": "batch-gene-profile-panel",
  "arm": "agent_without_biocli",
  "status": "completed",
  "final_answer": {
    "summary": "Built a batch triage profile for TP53, BRCA1, EGFR, PIK3CA, and NF1 from official NCBI Gene summaries, grouped into genome-stability and RTK-RAS-PI3K signaling neighborhoods for downstream filtering.",
    "result": {
      "panel_overview": {
        "genes": ["TP53", "BRCA1", "EGFR", "PIK3CA", "NF1"],
        "shared_axes": [
          "DNA damage response and genome stability",
          "RTK-RAS-PI3K growth and survival signaling"
        ],
        "triage_clusters": [
          {
            "cluster": "DNA_damage_genome_stability",
            "members": ["TP53", "BRCA1"]
          },
          {
            "cluster": "RTK_RAS_PI3K_signaling",
            "members": ["EGFR", "PIK3CA", "NF1"]
          }
        ],
        "ranking_basis": [
          "broad pathway centrality",
          "known cancer relevance",
          "potential to anchor pathway or interaction follow-up"
        ],
        "note": "Priority labels are inference-based triage hints derived from official gene summaries, not curated interaction scores."
      },
      "gene_profiles": [
        {
          "symbol": "TP53",
          "gene_id": "7157",
          "primary_role": "tumor suppressor",
          "mechanistic_axis": "stress-responsive transcriptional control",
          "high_level_processes": [
            "cell cycle arrest",
            "apoptosis",
            "senescence",
            "DNA repair",
            "metabolic adaptation"
          ],
          "panel_cluster": "DNA_damage_genome_stability",
          "follow_up_priority": "very_high",
          "triage_notes": "Broad hub for stress response and cancer biology; strong anchor for genome-stability review."
        },
        {
          "symbol": "BRCA1",
          "gene_id": "672",
          "primary_role": "tumor suppressor / DNA repair factor",
          "mechanistic_axis": "double-strand break repair and recombination",
          "high_level_processes": [
            "genomic stability",
            "DNA damage sensing",
            "transcription",
            "double-strand break repair",
            "recombination"
          ],
          "panel_cluster": "DNA_damage_genome_stability",
          "follow_up_priority": "very_high",
          "triage_notes": "Canonical DNA repair node with strong inherited-cancer relevance; pairs naturally with TP53 for genome-stability follow-up."
        },
        {
          "symbol": "EGFR",
          "gene_id": "1956",
          "primary_role": "receptor tyrosine kinase",
          "mechanistic_axis": "cell-surface growth factor signaling",
          "high_level_processes": [
            "receptor dimerization",
            "tyrosine autophosphorylation",
            "cell proliferation",
            "growth factor response"
          ],
          "panel_cluster": "RTK_RAS_PI3K_signaling",
          "follow_up_priority": "high",
          "triage_notes": "Upstream signaling receptor that can drive downstream RAS/PI3K pathway review and therapeutic triage."
        },
        {
          "symbol": "PIK3CA",
          "gene_id": "5290",
          "primary_role": "PI3K catalytic subunit / oncogenic kinase",
          "mechanistic_axis": "phosphoinositide phosphorylation",
          "high_level_processes": [
            "PtdIns phosphorylation",
            "PI3K signaling",
            "cell survival",
            "growth signaling"
          ],
          "panel_cluster": "RTK_RAS_PI3K_signaling",
          "follow_up_priority": "high",
          "triage_notes": "Core downstream effector in growth and survival signaling; useful for pathway-centric filtering and variant prioritization."
        },
        {
          "symbol": "NF1",
          "gene_id": "4763",
          "primary_role": "RAS pathway negative regulator",
          "mechanistic_axis": "Ras signal transduction braking",
          "high_level_processes": [
            "Ras signaling",
            "tumor suppression",
            "neurofibromatosis-related biology"
          ],
          "panel_cluster": "RTK_RAS_PI3K_signaling",
          "follow_up_priority": "high",
          "triage_notes": "Functional brake on Ras signaling; useful as an upstream modifier of EGFR/RAS/PI3K pathway behavior."
        }
      ],
      "cross_gene_relationships": [
        {
          "pair": ["TP53", "BRCA1"],
          "relationship": "shared genome-stability / DNA-damage neighborhood"
        },
        {
          "pair": ["EGFR", "PIK3CA"],
          "relationship": "upstream receptor-to-PI3K signaling adjacency"
        },
        {
          "pair": ["NF1", "EGFR"],
          "relationship": "NF1 opposes RAS-pathway output downstream of growth-factor signaling"
        },
        {
          "pair": ["NF1", "PIK3CA"],
          "relationship": "same growth/survival signaling neighborhood, with NF1 acting as a pathway brake"
        }
      ]
    }
  },
  "sources": [
    {
      "label": "NCBI Gene: TP53",
      "url": "https://www.ncbi.nlm.nih.gov/gene/7157",
      "record_ids": ["7157"]
    },
    {
      "label": "NCBI Gene: BRCA1",
      "url": "https://www.ncbi.nlm.nih.gov/gene/672",
      "record_ids": ["672"]
    },
    {
      "label": "NCBI Gene: EGFR",
      "url": "https://www.ncbi.nlm.nih.gov/gene/1956",
      "record_ids": ["1956"]
    },
    {
      "label": "NCBI Gene: PIK3CA",
      "url": "https://www.ncbi.nlm.nih.gov/gene/5290",
      "record_ids": ["5290"]
    },
    {
      "label": "NCBI Gene: NF1",
      "url": "https://www.ncbi.nlm.nih.gov/gene/4763",
      "record_ids": ["4763"]
    }
  ],
  "commands_used": [
    "rg --files /Volumes/KINGSTON/work/research/biocli/ncbicli/benchmarks/agent-ab/results/2026-04-15/raw/agent_without_biocli/batch-gene-profile-panel",
    "pwd"
  ],
  "web_queries": [
    "site:ncbi.nlm.nih.gov/gene TP53 NCBI Gene Homo sapiens",
    "site:ncbi.nlm.nih.gov/gene BRCA1 NCBI Gene Homo sapiens",
    "site:ncbi.nlm.nih.gov/gene EGFR NCBI Gene Homo sapiens",
    "site:ncbi.nlm.nih.gov/gene PIK3CA NCBI Gene Homo sapiens",
    "site:ncbi.nlm.nih.gov/gene NF1 NCBI Gene Homo sapiens"
  ],
  "warnings": [
    "Priority and clustering are inference-based triage hints derived from official summaries, not curated interaction strength scores."
  ],
  "errors": [],
  "recovery_actions": [],
  "runtime": {
    "wall_clock_ms": 150000,
    "tool_calls": 8
  }
}
